dimension,segment,spend_share,coverage_status,planning_action
Creative role,Proof & Credibility,37%,High,Pair performance proof points with stronger creative excellence hooks
Creative role,Action / Conversion,14%,Low,Add clearer next-step variants to the selected territories
Message territory,Don’t Just Play — Perform,36%,Primary,Version the core platform by buyer segment
Message territory,Drop Into The Moment,30%,Primary,Build a new Breaking Drop around the next timely moment
Message territory,Proof & Performance,35%,High,Balance evidence with artistry-led hooks
